Title,Authors,Publication Date,Journallink,Journal
Rank-and-file accounting employee compensation and financial reporting quality,,"In Press, Journal Pre-proof, Available online 7 January 2024",https://www.sciencedirect.com/science/article/pii/S0165410124000028/pdfft?md5=1741a83c869d76c7c6b6dc3a2d32f194&pid=1-s2.0-S0165410124000028-main.pdf,JAE-Journal of Accounting and Economics,Rank-and-file accounting employee compensation and financial reporting quality_JAE-Journal of Accounting and Economics.pdf
Do industry-specific accounting standards matter for capital allocation decisions?,,"In Press, Corrected Proof, Available online 28 December 2023",https://www.sciencedirect.com/science/article/pii/S0165410123000940/pdfft?md5=8f252844df5aa0923d7f1ac7edb84c61&pid=1-s2.0-S0165410123000940-main.pdf,JAE-Journal of Accounting and Economics,Do industry-specific accounting standards matter for capital allocation decisions+_JAE-Journal of Accounting and Economics.pdf
Auditor industry range and audit quality,,"In Press, Corrected Proof, Available online 20 November 2023",https://www.sciencedirect.com/science/article/pii/S0165410123000939/pdfft?md5=cafc8b0f67807c868183af432c675330&pid=1-s2.0-S0165410123000939-main.pdf,JAE-Journal of Accounting and Economics,Auditor industry range and audit quality_JAE-Journal of Accounting and Economics.pdf
Disclosure paternalism,,"In Press, Corrected Proof, Available online 17 November 2023",https://www.sciencedirect.com/science/article/pii/S0165410123000861/pdfft?md5=569b2227fa3b3b0d83aa29dae6183974&pid=1-s2.0-S0165410123000861-main.pdf,JAE-Journal of Accounting and Economics,Disclosure paternalism_JAE-Journal of Accounting and Economics.pdf
Accounting information and risk shifting with asymmetrically informed creditors,,"In Press, Corrected Proof, Available online 10 November 2023",https://www.sciencedirect.com/science/article/pii/S0165410123000915/pdfft?md5=ef559a7585a296bd01e84d98bd7d0d5f&pid=1-s2.0-S0165410123000915-main.pdf,JAE-Journal of Accounting and Economics,Accounting information and risk shifting with asymmetrically informed creditors_JAE-Journal of Accounting and Economics.pdf
“Just BEAT it” do firms reclassify costs to avoid the base erosion and anti-abuse tax (BEAT) of the TCJA?,,"In Press, Corrected Proof, Available online 9 November 2023",https://www.sciencedirect.com/science/article/pii/S0165410123000721/pdfft?md5=edc0f9ee9ab919c2307d618b03ed69a9&pid=1-s2.0-S0165410123000721-main.pdf,JAE-Journal of Accounting and Economics,“Just BEAT it” do firms reclassify costs to avoid the base erosion and anti-abuse tax (BEAT) of the TCJA+_JAE-Journal of Accounting and Economics.pdf
Gone with the big data: Institutional lender demand for private information,,"In Press, Corrected Proof, Available online 7 November 2023",https://www.sciencedirect.com/science/article/pii/S0165410123000873/pdfft?md5=4a02ef48962f346c5058070a260b7e0e&pid=1-s2.0-S0165410123000873-main.pdf,JAE-Journal of Accounting and Economics,Gone with the big data+ Institutional lender demand for private information_JAE-Journal of Accounting and Economics.pdf
The effect of patent disclosure quality on innovation,,"In Press, Corrected Proof, Available online 29 September 2023",https://www.sciencedirect.com/science/article/pii/S016541012300071X/pdfft?md5=c2348acc6bda41e386554e56a1f6c066&pid=1-s2.0-S016541012300071X-main.pdf,JAE-Journal of Accounting and Economics,The effect of patent disclosure quality on innovation_JAE-Journal of Accounting and Economics.pdf
Long-term firm gains from short-term managerial focus: Myopia and voluntary disclosures,,"In Press, Corrected Proof, Available online 28 September 2023",https://www.sciencedirect.com/science/article/pii/S0165410123000708/pdfft?md5=d27795919c9fc9b136a30ce2f1a04b7b&pid=1-s2.0-S0165410123000708-main.pdf,JAE-Journal of Accounting and Economics,Long-term firm gains from short-term managerial focus+ Myopia and voluntary disclosures_JAE-Journal of Accounting and Economics.pdf
The misuse of regression-based x-Scores as dependent variables,,"In Press, Corrected Proof, Available online 12 September 2023",https://www.sciencedirect.com/science/article/pii/S0165410123000678/pdfft?md5=d5c0f14a78b23cc0c7a2753d6d4bbb20&pid=1-s2.0-S0165410123000678-main.pdf,JAE-Journal of Accounting and Economics,The misuse of regression-based x-Scores as dependent variables_JAE-Journal of Accounting and Economics.pdf
Firm-level political risk and credit markets,,"In Press, Corrected Proof, Available online 9 September 2023",https://www.sciencedirect.com/science/article/pii/S0165410123000666/pdfft?md5=cf51a9085d1f40a9e84c207839330f93&pid=1-s2.0-S0165410123000666-main.pdf,JAE-Journal of Accounting and Economics,Firm-level political risk and credit markets_JAE-Journal of Accounting and Economics.pdf
Capital-market effects of tipper-tippee insider trading law: Evidence from the Newman ruling,,"In Press, Corrected Proof, Available online 25 August 2023",https://www.sciencedirect.com/science/article/pii/S0165410123000630/pdfft?md5=34647e88846d93e7abfa0c7bcc872fe5&pid=1-s2.0-S0165410123000630-main.pdf,JAE-Journal of Accounting and Economics,Capital-market effects of tipper-tippee insider trading law+ Evidence from the Newman ruling_JAE-Journal of Accounting and Economics.pdf
The SEC's September spike: Regulatory inconsistency within the fiscal year,,"In Press, Corrected Proof, Available online 12 August 2023",https://www.sciencedirect.com/science/article/pii/S0165410123000605/pdfft?md5=48778fdc5af01ff955afb71389ef3a70&pid=1-s2.0-S0165410123000605-main.pdf,JAE-Journal of Accounting and Economics,The SEC's September spike+ Regulatory inconsistency within the fiscal year_JAE-Journal of Accounting and Economics.pdf
Accounting conservatism and managerial information acquisition,,"In Press, Corrected Proof, Available online 6 August 2023",https://www.sciencedirect.com/science/article/pii/S016541012300054X/pdfft?md5=1b7c585f65528baf9c3d63f67ed7f2bb&pid=1-s2.0-S016541012300054X-main.pdf,JAE-Journal of Accounting and Economics,Accounting conservatism and managerial information acquisition_JAE-Journal of Accounting and Economics.pdf
Data visualization in 10-K filings,,"In Press, Corrected Proof, Available online 24 July 2023",https://www.sciencedirect.com/science/article/pii/S0165410123000551/pdfft?md5=13478877733b88a2527cc25648204d99&pid=1-s2.0-S0165410123000551-main.pdf,JAE-Journal of Accounting and Economics,Data visualization in 10-K filings_JAE-Journal of Accounting and Economics.pdf
Public environmental enforcement and private lender monitoring: Evidence from environmental covenants,,"In Press, Corrected Proof, Available online 19 July 2023",https://www.sciencedirect.com/science/article/pii/S0165410123000459/pdfft?md5=48a7b43e7962c2d4a3e1f8cf6ff209fe&pid=1-s2.0-S0165410123000459-main.pdf,JAE-Journal of Accounting and Economics,Public environmental enforcement and private lender monitoring+ Evidence from environmental covenants_JAE-Journal of Accounting and Economics.pdf
